<?xml version="1.0" encoding="UTF-8"?>
<set xsi:noNamespaceSchemaLocation="FontConversionTestData.xsd"
  xmlns:xsi="http://www.w3.org/2001/XMLSchema-instance">

  <case local="iрb-iука{ увfча" unicode="ш́рӣ-ш́уках̣ ува̄ча" />
  <case local="iрb iрb гуру-гаурfyга джаята{" unicode="ш́рӣ ш́рӣ гуру-гаура̄н̇га джаятах̣" />
  <case local="виджufйа" unicode="виджн̃а̄йа" />
  <case local="сарва-бхeта-хhдайаv" unicode="сарва-бхӯта-хр̣дайам̇" />
  <case local="g" unicode="р̣̄" />
  <case local="u" unicode="н̃" />
  <case local="z" unicode="у̃" />
</set>
