<?xml version="1.0" encoding="UTF-8"?>
<set xsi:noNamespaceSchemaLocation="FontConversionTestData.xsd"
  xmlns:xsi="http://www.w3.org/2001/XMLSchema-instance">

  <case local="çréçréguru-gauräìgau jayataù" unicode="śrīśrīguru-gaurāṅgau jayataḥ" />
  <case local="Ï" unicode="Ñ" />
  <case local="Î" unicode="Ã" />
  <case local="¾" unicode="[tilak]" />
  <case local="·" unicode="[lotus]" />
  <case local="Í" unicode="ī̃" />
  <case local="é" unicode="ī" />
</set>
